Season,Months,Common Diseases,Details
Spring,Feb–Apr,"Pollen Allergies, Flu, Respiratory Problem, Eye Allergies","Allergies due to pollen, flu from temp fluctuation..."
Summer,May–Aug,"Diarrhea, Heatstroke, Malaria, Dengue","Caused by contaminated food/water..."
Monsoon,Jul–Sep,"Dengue, Malaria, Diarrhea","Mosquito-borne diseases increase..."
Autumn,Oct–Nov,"Respiratory Infections, Flu, Smog-related Issues","Smog & dry air cause Respiratory Problems..."
Winter,Dec–Jan,"Flu, Pneumonia, Bronchitis, Respiratory Problem","Cold air increases respiratory infections..."